{
  "$schema": "http://json-schema.org/draft-07/schema#",
  "title": "AI Assistant Output Package Manifest",
  "description": "The machine-readable 'blueprint for action' generated in Output-First mode. It is the single source of truth for the `ai-execute` script, acting as the formal contract between the 'thinking' and 'doing' parts of the system.",
  "type": "object",
  "required": [
    "version",
    "sessionId",
    "generated_by",
    "actions"
  ],
  "properties": {
    "version": {
      "type": "string",
      "description": "The schema version of the manifest."
    },
    "sessionId": {
      "type": "string",
      "description": "A unique, timestamp-based ID for the generation run."
    },
    "generated_by": {
      "type": "string",
      "description": "The alias of the persona that created the plan."
    },
    "actions": {
      "type": "array",
      "description": "A sequential list of action objects to be executed.",
      "items": {
        "type": "object",
        "required": [
          "type",
          "comment"
        ],
        "properties": {
          "type": {
            "type": "string",
            "description": "The action to perform (e.g., 'create_branch', 'apply_file_change')."
          },
          "comment": {
            "type": "string",
            "description": "The AI's 'thought' or rationale for the action."
          }
        },
        "additionalProperties": true
      }
    }
  }
}