{
  "version": "1.1",
  "sessionId": "run-20231027-120000",
  "generated_by": "domains/programming/swe-1",
  "actions": [
    {
      "type": "create_branch",
      "comment": "Create a new feature branch.",
      "branch_name": "feature/new-thing"
    },
    {
      "type": "apply_file_change",
      "comment": "Update the main application file.",
      "source": "workspace/src/main.py",
      "target": "src/main.py"
    },
    {
      "type": "git_commit",
      "comment": "Commit the changes.",
      "message": "feat: Implement new feature"
    }
  ]
}